review_id,product_id,title,author,rating,content,timestamp,profile_id,is_verified,helpful_count,product_attributes
R3A64M8DKIYLUT,B07PXGQC1Q,5.0 out of 5 stars Apple AirPods (2nd Generation) Review,nachum zlotnick,5,"The Apple AirPods (2nd Generation) have been a popular choice among wireless earbud users since their release. Here's a detailed review covering various aspects:#### Design and Build Quality- **Design**: The AirPods maintain the iconic, minimalist design with a white finish. They are compact, lightweight, and fit comfortably in most ears.- **Build Quality**: They are made of high-quality plastic, which feels durable and premium. The magnetic case is sturdy and ensures the earbuds stay in place.#### Sound Quality- **Audio Performance**: The sound quality is clear and well-balanced, suitable for a wide range of music genres. The bass is adequate, though not as deep as some premium alternatives.- **Microphone**: The microphone quality is excellent for calls, thanks to beamforming technology that reduces background noise.#### Connectivity- **Bluetooth**: The 2nd Generation AirPods use Bluetooth 5.0, providing a stable and efficient connection. Pairing is seamless, especially with Apple devices due to the H1 chip.- **H1 Chip**: This chip allows for faster and more stable wireless connections, improved sound quality, and hands-free ""Hey Siri"" support.#### Battery Life- **Earbuds**: The earbuds offer up to 5 hours of listening time on a single charge.- **Charging Case**: The case provides multiple additional charges, extending the total battery life to more than 24 hours.- **Charging Options**: The case charges via a Lightning connector, and there is a wireless charging case available as an optional upgrade.#### Features- **Automatic Ear Detection**: The AirPods automatically pause playback when you remove them from your ears and resume when you put them back in.- **Touch Controls**: You can double-tap to play or skip forward.- **Hey Siri**: Voice-activated Siri support allows for hands-free control.#### Compatibility- **Apple Ecosystem**: Seamless integration with iPhones, iPads, Macs, and Apple Watches. Pairing is quick and easy, with automatic device switching.- **Android Devices**: The AirPods can be used with Android devices, though some features like automatic ear detection and Siri are not available.#### Pros and Cons**Pros:**- Seamless integration with Apple devices- Good sound quality- Long battery life with the charging case- Comfortable fit- Reliable connectivity with the H1 chip- Hands-free Siri support**Cons:**- Expensive compared to other wireless earbuds- Limited customization of touch controls- No active noise cancellation (ANC)- The white color can get dirty easily- Not ideal for audiophiles seeking superior sound quality#### ConclusionThe Apple AirPods (2nd Generation) are a solid choice for anyone deeply integrated into the Apple ecosystem, offering convenience, decent sound quality, and excellent connectivity. However, if you are looking for advanced features like noise cancellation or superior audio performance, you might want to consider other options or the AirPods Pro.Overall, they are a reliable and user-friendly option for everyday use, especially for those who prioritize convenience and seamless integration with their Apple devices.","Reviewed in the United States June 21, 2024",AEZU6KZWHPTL7JX3GXOFQHKM73UA,TRUE,15,Set: Without AppleCare+
R1F236Q566CSRQ,B07PXGQC1Q,5.0 out of 5 stars **‚≠êÔ∏è‚≠êÔ∏è‚≠êÔ∏è‚≠êÔ∏è‚≠êÔ∏è Best Wireless Earbuds I've Ever Owned!**,Christopher Domenici,5,"I recently purchased the Apple AirPods (2nd Generation) Wireless Ear Buds, and I couldn't be happier with my decision. From the moment I unboxed them, I was impressed with their sleek design and the effortless setup process. Within seconds, they were seamlessly paired with my iPhone, and I was ready to enjoy my music, podcasts, and calls.The sound quality is outstanding, delivering clear, crisp audio with a balanced bass that enhances every listening experience. Whether I'm listening to my favorite tunes, taking an important call, or catching up on the latest podcast, the sound is always top-notch.The fit is incredibly comfortable, even during extended use. They stay securely in place whether I'm working out, commuting, or just relaxing at home. The battery life is impressive, providing hours of uninterrupted listening, and the charging case is a game-changer. Just a quick charge gives me hours of use, making them perfect for long days on the go.One of the standout features is the seamless integration with Siri. Voice commands work flawlessly, making it easy to control my music, make calls, and check messages without having to reach for my phone. The built-in microphones ensure my voice comes through loud and clear, even in noisy environments.Overall, the Apple AirPods (2nd Generation) have exceeded my expectations in every way. They are the perfect combination of style, convenience, and superior sound quality. I highly recommend them to anyone looking for high-quality wireless earbuds. Well done, Apple!","Reviewed in the United States July 24, 2024",AGRIDBGN53EGTU3SUFCAVHTUS2XA,TRUE,23,Set: Without AppleCare+
R2QGEC3WRQRMLX,B07PXGQC1Q,5.0 out of 5 stars Very practical,renee,5,"Taking the Apple AirPods at face value, they're a solid headset for the money! If you already have the original, first generation AirPods and just want to upgrade, not a bad option either. The 2nd generation AirPods feature an improved software chip & runs off of BlueTooth 5.0 vs 4.1 (Gen 1). The software chip allows a faster, stronger, and more stable connection with your device(s). This particular item for $139.00 does NOT feature the wireless charging case. This one must be plugged in via USB (cable provided in the box) to an outlet or USB port. The wireless charging case model is $169. Now if you're looking to upgrade to the wireless charging case later on, you can. Apple does sell it separately. If you want the wireless charging option right out of the box, I recommend sending the $169 vs the $139 product here.Sound quality: Straight out of the box, sound is pretty solid. No crackles, static, pops, or any abnormal noises created by the more economic-friendly headsets. You have a lot more adjustability & tuning capabilities if paired on an iOS/Apple device vs using for example paired with an Android OS device. So, ultimately Apple users may or may not get a better sound quality experience.Noise cancellation: AirPods do fit fairly well in the ear without having to be jammed inside your ear canal. Generally they create a snug fit using Apple's ""universal"" earphone design, it is one size fits most not one size fits all. Some users have upgraded or opted to spend the additional funds on a set of AirPods Pro due to the rubber tips for a better/snug fit. I believe only the AirPods Pro currently has an active noise cancellation utilizing two microphones but I would double-check Apple for accurate information. Also, for Android users. The Galaxy buds by Samsung feature active noise cancellation & wireless charging case on every model so you might want to look into that product before making a final purchase.Battery life: For optimal battery life, I highly recommend charging both AirPods inside the case. The case itself is a battery pack with a life. So if one or both AirPods are low on battery, you can toss them in the case and charge them up. Apple I believe rates 5 minutes of charging time is equivalent to 1 hour of talk/listening time and 15 minutes of charging time is equivalent to 2 hours of talk/listening. I'm sure this is accurate when they're brand new but I'm sure like anything, normal ware & tare might diminish that over time.Warranty: Apple provides a 1-year standard manufacturer's warranty on this product. This ONLY covers defects/defaults from the manufacturer. This will NOT cover physical and/or liquid damages to AirPods, case, or charging cable included.AppleCare: It's $29.00 and 2 years and well worth the extra money. You're already spending this kind of money on a headset, may as well have protection. We get it, accidents happen! But protect yourself and get your AirPods repaired/replaced at no additional cost to YOU! There is no additional fees or deductibles involved.AppleCare tips:You don't have to install AppleCare right away. You have 60 days from the original purchase date to contact Apple by providing your AirPods serial number (on outside of the box) and Apple will tell you if you're still eligible.You can renew AppleCare for another 2 years for the same fee of $29.00 provided you want to keep the same product. If you decide to upgrade to the AirPods Pro or whatever the latest model is, you would have to purchase AppleCare for that specific product.You can go into an Apple store location and get live repair/replacement on your AirPods.Using AirPods with Android:Apple has allowed Android and other non-iOS devices to use AirPods since the AirPods pair/connect via BlueTooth.If you're using AirPods on an Android platform such as Samsung or LG for example there's 2 ways to pair the headset to your device. You either turn on BlueTooth on your device, pop both AirPods inside your ear, find ""AirPods"" under available connections, and connect. Or you might have to pair manually using the button on the AirPods case to make available, pair, and connect.FAIR WARNING:You will NOT have access to all features that the AirPods have to offer on an Apple/iOS device. You will be limited on functions you can perform.I was able to find an app on Google play store for $1.99 called ""AirPopUp"". It is a paid application that unlock access to certain/more features of the AirPods similar to what an Apple/iOS device would be granted. Be aware that you will NOT have access nor the ability to have every single feature since you're not on Apple's network. There may be other apps (most likely paid applications) you'd have to find that may unlock more features such as: AirPods battery life percentage, case battery life percentage, programming LEFT & RIGHT AirPods for certain function(s), skipping/pausing/resetting songs, answer/decline/hang up phone calls, find my AirPods, and more.For Samsung users specifically, you might want to look into the Galaxy Buds. They're a little cheaper than AirPods, I believe Amazon has them for $109.99 + $22 3-Year insurance through Assurion that does cover physical/liquid/accidental damage just like AirPods.Galaxy Buds features:Made by SamsungAudio powered by AKGRubber ear bud tipsPair with Samsung device to get the mostWireless charging caseActive noise cancellationComes in multiple colors (black/white/silver/yellow/red & black combo with Star Wars edition Galaxy Note 10+)Includes changing cord and replacement rubber earbud tips.I know if you pair the Galaxy Buds with a Samsung device it will automatically download an application titled ""Galaxy Wearable"". This allows users to check battery life status of the case and each bud, prompts you for software updates, ability to program LEFT & RIGHT earbuds to do certain function(s), answer/decline/hang up phone calls, pause/skip/reset songs.Apple may charge a lot of money for their products on accessories but they never fall short of being a revolutionary, well-designed, reliable product that works as advertised.","Reviewed in the United States October 19, 2023",AEYO6M357PGA7I2MHHB2FQ5FSDEA,TRUE,224,Set: Without AppleCare+
R1L7RJCQRMP8HZ,B07PXGQC1Q,5.0 out of 5 stars Perfect balance of convenience and comfort,Vinay Medishetty,5,"The media could not be loaded. I recently purchased the Apple AirPods (2nd Generation) and couldn't be happier with my decision. These wireless earbuds deliver on all fronts, offering both exceptional sound quality and unmatched convenience.**Pros:**1. **Effortless Setup:** Pairing the AirPods with my iPhone was a breeze. The instant connection feature is a game-changer, making it incredibly easy to switch between devices.2. **Battery Life:** The battery life is impressive, lasting over 24 hours with the included Lightning charging case. I can go days without needing to recharge, which is perfect for my on-the-go lifestyle.3. **Sound Quality:** The sound quality is excellent, providing clear, crisp audio whether I'm listening to music, podcasts, or taking calls. The built-in microphone also works well for voice commands and phone conversations.4. **Comfort:** The design of the AirPods ensures a comfortable fit, even during extended use. They stay in place during workouts and daily activities.5. **Portability:** The compact size of the AirPods and the charging case make them incredibly portable. They easily fit into my pocket or bag, ready for use whenever I need them.**Cons:**1. **Price:** While the AirPods are a bit pricey compared to other wireless earbuds on the market, I believe the quality and convenience justify the cost.2. **Customization:** There are limited options for customizing the sound profile. However, the default settings are satisfactory for most users.Overall, the Apple AirPods (2nd Generation) are a fantastic investment for anyone seeking high-quality wireless earbuds. They offer a seamless experience with Apple devices, excellent battery life, and superior sound quality. Highly recommended!","Reviewed in the United States July 9, 2024",AGJEEE2NO5K4FZZH3ANG2YCS3Y6Q,TRUE,25,Set: Without AppleCare+
R2R9VD3N1ZT9MO,B07PXGQC1Q,4.0 out of 5 stars Great Sound and Convenience with Minor Drawbacks,Adam Abdou-Gustavson,4,"I've been using the Apple AirPods 2nd Generation for a few months now, and overall, I'm very pleased with my purchase. These earbuds offer a lot of convenience and solid performance.Pros:Sound Quality: The audio quality is excellent, with clear highs and balanced mids. They‚Äôre great for listening to music, podcasts, and making phone calls.Seamless Connectivity: Pairing the AirPods with my iPhone and other Apple devices is incredibly smooth. The instant connection and switching between devices are standout features.Comfort and Fit: They fit comfortably in my ears and stay in place during workouts. I can wear them for hours without any discomfort.Battery Life: The battery life is impressive. I get several hours of continuous use, and the charging case provides multiple additional charges, making them perfect for long days and travel.Siri Integration: Hands-free Siri access is a handy feature, allowing me to control music, make calls, and get information without needing to touch my phone.Cons:Lack of Noise Cancellation: Unlike the Pro version, these AirPods don‚Äôt have active noise cancellation. While they do a decent job of passive noise isolation, it‚Äôs not enough in noisy environments.Price: They‚Äôre a bit on the expensive side, especially considering the lack of noise cancellation. There are other earbuds with similar or better features at a lower price point.Fit May Vary: While they fit my ears well, I‚Äôve heard from friends that they don‚Äôt fit everyone perfectly. It‚Äôs worth trying them on before committing to a purchase.In summary, the Apple AirPods 2nd Generation offer great sound quality, convenience, and battery life, making them a solid choice for anyone in the Apple ecosystem. While they lack some advanced features like noise cancellation, they still provide a fantastic listening experience and seamless integration with Apple devices.","Reviewed in the United States May 31, 2024",AH7LXZF3MXW5WLMCOOZJXPKU6NBQ,TRUE,39,Set: Without AppleCare+
R1I4AC74H3NMTG,B07PXGQC1Q,5.0 out of 5 stars Great headphones,Sebastian,5,I bought these over 2 years ago and they still work great. They were originally a gift for my mom but she ended up preferring wired headphones so I kept them. I use them for the gym almost every day and they‚Äôre still going strong. I recommend everyone get these. The only problem is sometimes when you‚Äôre sweaty they will slip out. Other than that they‚Äôre great. The sound quality is fantastic and they last a long time without having to charge.,"Reviewed in the United States July 23, 2024",AF4ECYUKWRCSZUMQX7TGMKZWSW2Q,TRUE,11,Set: Without AppleCare+
R2HFARWKGGKX25,B07PXGQC1Q,5.0 out of 5 stars Great quality and price,Ruby,5,"Most ‚Äúofficial‚Äù websites and stores have these at around $200 when these are the exact same. The sound quality is great and the charging is very fast. The fit is alright but that‚Äôs on Apple, I guess. The volume control is a little weird since the left one is slightly louder but you can‚Äôt really tell unless you‚Äôre really paying attention to it.","Reviewed in the United States July 29, 2024",AEDFNJY4VWMPWWFQ4DNMTS2OJDPA,TRUE,3,Set: Without AppleCare+
R3NZ2BURXAQ8U0,B07PXGQC1Q,5.0 out of 5 stars Amazing Upgrade ‚Äì Worth Every Penny!,Casey Kimbro,5,"I recently upgraded to the AirPods Pro 2, and I couldn't be happier with my decision! These earbuds are a significant improvement over the original AirPods Pro, and here's why they deserve five stars:**Exceptional Sound Quality:** The sound quality on the AirPods Pro 2 is phenomenal. The audio is crisp, clear, and well-balanced across all frequencies. Whether I'm listening to music, podcasts, or taking calls, everything sounds fantastic.**Superior Noise Cancellation:** The noise cancellation on these is next level. They effectively block out background noise, making my commute and work environment much more pleasant. The transparency mode is also improved, allowing me to hear my surroundings clearly when needed.**Comfortable Fit:** The redesigned ear tips and overall fit are incredibly comfortable. I can wear them for hours without any discomfort, and they stay securely in place during workouts and runs.**Long Battery Life:** The battery life has seen a noticeable upgrade. I can use them throughout the day with no worries about running out of charge. The quick charge feature is also a lifesaver for those times when I forget to charge them overnight.**Seamless Connectivity:** As expected from Apple, the connectivity is seamless. Pairing them with my iPhone and other Apple devices is effortless, and the connection remains stable even at a distance.**Sleek Design:** The design of the AirPods Pro 2 is sleek and stylish. The case is compact and easy to carry around, and the earbuds themselves look great.**Enhanced Features:** The new features like spatial audio and adaptive EQ make a noticeable difference in the listening experience. It feels like the sound is coming from all around me, providing an immersive experience.Overall, the AirPods Pro 2 is a fantastic upgrade that has exceeded my expectations in every way. They offer excellent sound quality, superb noise cancellation, and a comfortable fit, making them worth every penny. Highly recommended for anyone looking to elevate their audio experience!---I hope this review meets your needs! If you'd like any changes or additional details, just let me know.","Reviewed in the United States August 6, 2024",AEUFIS7O7QEES5D5Q2A6EQFEG4KA,TRUE,0,Set: Without AppleCare+
R2QX8ORAQKFYAE,B07PXGQC1Q,5.0 out of 5 stars Seamless Connectivity and Great Sound Quality,Candace Pruett,5,"I was initially skeptical about getting the Apple AirPods (2nd Generation), but now I don't know why I waited so long. These wireless earbuds have exceeded my expectations in every way.One of the standout features is how seamlessly they connect to my phone. As soon as I take them out of the case, they automatically connect, making it incredibly convenient to use. The wireless aspect is a game-changer, allowing me to listen without any cords getting in the way.The fit is perfect for my ears, and they stay securely in place, even during workouts or when I'm on the go. The sound quality is excellent, delivering clear and crisp audio for both music and calls.Another feature I love is the ability to connect the AirPods to my phone to locate them if they ever go missing. This has saved me from losing them on more than one occasion.Overall, I am very satisfied with my purchase. The Apple AirPods (2nd Generation) offer seamless connectivity, great sound quality, and the convenience of a wireless design. Highly recommended for anyone looking to upgrade their listening experience.","Reviewed in the United States July 18, 2024",AF643IOE6C247W4KSADWO4YFH7OA,TRUE,1,Set: Without AppleCare+
R1B9HSCGVJI0MF,B07PXGQC1Q,4.0 out of 5 stars Game Changer for My Daily Commute!,misty,4,"I recently upgraded to the Apple AirPods (2nd Generation), and I am absolutely thrilled with my purchase! These AirPods have genuinely transformed my daily routine in several ways.Sound Quality: The sound quality is phenomenal. Whether I'm listening to music, podcasts, or making calls, the clarity and depth are outstanding. The bass is punchy without being overwhelming, and the mids and highs are crisp.Comfort and Fit: I was worried about how they would fit since I have small ears, but these AirPods sit comfortably and securely. I can wear them for hours without any discomfort, which is a huge plus for long commutes or work sessions.Battery Life: The battery life is impressive. I get around 5 hours of listening time on a single charge, and the charging case provides multiple recharges, extending the total battery life to more than 24 hours. Plus, the quick charge feature is super handy when I'm in a rush.Convenience: The seamless integration with my iPhone is another big win. The AirPods automatically connect as soon as I put them in my ears, and switching between my devices is effortless. Siri support is also a great feature for hands-free control.Design and Build: The design is sleek and minimalistic, and the build quality feels premium. The charging case is compact and fits easily into my pocket.Overall, the Apple AirPods (2nd Generation) have exceeded my expectations. They are a bit pricey, but the convenience, sound quality, and seamless Apple ecosystem integration make them well worth the investment. Highly recommended!","Reviewed in the United States July 16, 2024",AE4Y3NF6JXE3QS3DL3T6PUII2TGA,TRUE,0,Set: Without AppleCare+
R3PM8B3ME4754P,B07PXGQC1Q,4.0 out of 5 stars Fit and lightweight,LJA,4,"After ordering these, I found out that they are NOT water or moisture resistant at all. I was initially buying them in large part for my workouts so now I have to be concerned about sweat damaging them. I had planned to return them, but I fallen in love. They are so lightweight and it‚Äôs great for work because I can leave them in all day without that bothersome earphone discomfort. They do not block out noice but i prefer this for my use. The left one feels a bit loose, but everybody‚Äôs ears are different.I did stop at the Apple Store to try on the AirPod 3 - but I just don‚Äôt like the way it feels or fits. The 3 however does sound even better and love the shorter stems. Best of all - water proof. But the 3 kept falling out of my ears too easily. So I‚Äôve decided to keep the airpod 2 even though its 5 yrs old. While the sound quality is not as good for sure - It‚Äôs still good","Reviewed in the United States July 21, 2024",AFUFGMZRCA4KZH6XUMYHRBIA5NMQ,TRUE,0,Set: Without AppleCare+
RZIH7QCJEPABL,B07PXGQC1Q,5.0 out of 5 stars Still Good Airpods Even In 2024,Sand,5,"This is my first time ordering Airpods through Amazon. I was nervous because even though I've been a prime member since 2017, I usually buy Apple products straight from the Apple Store. But the packaging was new as described and the product meets my expectations all while being heavily discounted compared to the original price.The 2nd generation Airpods may have been released in early 2019, but even today they still deliver great value. I like the sound and the fit is great. They're intuitive to connect to any Apple product and I like incorporating them into my Apple ecosystem. I would recommend these to anyone looking for Airpods who is on a budget.","Reviewed in the United States July 29, 2024",AG5MAA3QARFZZOEM6QNMVV23MU2Q,TRUE,0,Set: Without AppleCare+
R33GZ0TXSTNIX2,B07PXGQC1Q,5.0 out of 5 stars Worth the money,Elijah,5,"I‚Äôve personally wanted air pods for a while, so recently I‚Äôve gotten a job, and now, able to afford them I bought them. And let me tell you they are worth the hours I put in. The sound is great. You have to get used to the comfort. Really easy to use daily, just pop them in and you listening to music, talking on calls, or watching videos. They charge super fast, and the case acts like a backup if the pods die on the go, very convenient. Over all, great product, would recommend.","Reviewed in the United States August 4, 2024",AFHJJWYIDPGTWBEEDIXIRVVTZQUQ,TRUE,0,Set: Without AppleCare+
R32MA0LD962Y2O,B07PXGQC1Q,4.0 out of 5 stars Almost perfect. Definitely better than 1st gen.,Richard,4,"I like this particular design as it allows me to still hear my surroundings. I use them to listen to my computer while I play music on my stereo in the background. I also don't feel them in my ear which is super nice. Over the ear headphones get too warm and uncomfortable, and in ear earbuds block out sound and get uncomfortable over extended use, so these are perfect. These also stay connected compared to my first ten AirPods which would constantly drop the connection. My only gripe is when I attempt to stream Spotify on my iPhone to my home stereo the AirPods will take over and connect if I am wearing them while using them for the computer, so I have to go back into Spotify on my phone and reconnect it to the stereo. Not the end of the world, but I wish there was a way to prevent that from happening. It would be great if you could disable auto connect by app. That said, I love these.","Reviewed in the United States July 14, 2024",AHOXIKLL6P6ZTUVXUVKD4ZOBABZA,TRUE,1,Set: Without AppleCare+
