review_id,product_id,title,author,rating,content,timestamp,profile_id,is_verified,helpful_count,product_attributes
R1RA749L7T4EPM,B0BZ9WMLNQ,5.0 out of 5 stars Best earbuds I've had under $100.,Caleb e.,5,"I like how seamless it is with a pixel 6a, they have some flaws like connecting when charging. But other than that they're perfect, they sound great. Even the bass tuning is pretty good. The touch controls are very useful, along with voice control. The pixel buds a series are also very comfortable, sometimes I forget they're there.","Reviewed in the United States May 14, 2024",AE633PSJDWMHM2QOLIVJRMNRUUQA,TRUE,0,Color: CharcoalStyle: Pixel Buds
RW1CUIT5TS46S,B0BZ9WMLNQ,5.0 out of 5 stars Easy set up,Moonlight,5,Loved the look and the fact that they came charged. They fit perfectly and connected to my phone in seconds.,"Reviewed in the United States June 1, 2024",AHMVYZLTBIPXVLFGNH4ESHYJFEMQ,TRUE,0,Color: SeaStyle: Pixel Buds
R2N6GLU60E0O70,B0BZ9WMLNQ,5.0 out of 5 stars They're FINE.,Quentin,5,"Ok, so I really only bought these because I was curious about the difference between the $10-20 earbuds I was used to using (with no real functional complaints) versus a more expensive, near-premium experience. I had also just bought a Pixel phone, so I figured, what the heck, let's get the ecosystem since I'd never fully done that before (I also bought the Pixel watch). And honestly, while they're fine and the audio is great and the easy connection to a Google phone is convenient, I'm not sure it's $60-80 better than the cheap stuff we buy and replace all the time. I mean, don't get me wrong, it's nice to have Google assistant on call, handsfree, especially after I've gotten so used to using it at home that I sometimes call out to Google in public places only to catch myself mid ‚ÄùHey Goo-."" But honestly, most earbuds at least allow you to press and call Google or Alexa, so again, my quibble isn't we with the buds being good. They are. But if you're a practical spender like me and also have a tight budget (or just don't want to spend more than you have to), I'd put it like this: these earbuds are more than worth the money if calling Google assistant anywhere, at anytime with just a whisper is super important to you. Otherwise, save a few bucks and get something in the $40-60 range and you'll still get 95% of what comes with these. But if you have the money to spend and don't care too much, yeah, these are fine. They fit fine, they last for a decent amount of time, and the charging case feels premium. But I was a bit underwhelmed after using em for a bit because I guess I expected something that would fundamentally raise my expectations for earbuds moving forward and I don't think these did that. I'll probably still switch between these and my $10 buds from time to time, probably keeping these in the car since the house wired with Google inside.","Reviewed in the United States December 8, 2022",AGJSG3XDDL5RCKG5D646IJTVF3TA,TRUE,40,Color: CharcoalStyle: Pixel Buds
RF574C7KF8UQK,B0BZ9WMLNQ,5.0 out of 5 stars By far the best pair of earbuds/phones I've ever owned,BTC,5,"The Pixel Buds are unquestionably the best set of ear-anything I've ever owned. Combined with my Pixel 6 XL, the buds are picked up instantaneously upon being removed from the case. The battery life is excellent and the case holds several additional charges. Thus far I've never run out of a charge. Not even sure I've gone below 75%, honestly.The best part about these, which can't be said for many other buds, is that you don't have to pair them to use them. You can use one of them and then switch over to the other if you want to maximize battery life (or simply don't want to or can't use both at the same time). This feature is often reserved for buds that are much more expensive than these.My final comment - and perhaps the most important - is the fit. Absolutely perfect. I have avoided buds over the years at all costs because I can just never get them to sit right in my ear. They fall out, they hurt, whatever. I do a lot of work around the house and get sweaty (I live in Florida, tough not to be sweaty...) and have had buds just drop out of my ear because of that. Never has that happened yet with these buds. They're so comfortable you can forget they're even in there.Do yourself a favor and pick these up. Top notch all around.","Reviewed in the United States September 24, 2023",AGBJX6HZBSAZYMTNWHT623RPZMOA,TRUE,19,Color: Clearly WhiteStyle: Pixel Buds
R1VIMUAFE807AW,B0BZ9WMLNQ,"4.0 out of 5 stars Great Headphones, Not Good for Small Ears",kmclean,4,"I loved these headphones but they killed my ears after just 30 minutes of use. I tried to break them in, but after 2 weeks they hurt my ears so badly when I'd take them out. I am a petite 5'2 female and feel like I have an average ear size, but these were way too big to be comfortable.I gave them to my husband and he loves them. If you have small ears, look elsewhere, otherwise they are a good buy!","Reviewed in the United States January 8, 2024",AF2R6EJKJEPNN7L4WEJUPMIGE3FA,TRUE,2,Color: SeaStyle: Pixel Buds
R3VEOTHXAN30WJ,B0BZ9WMLNQ,3.0 out of 5 stars Good but they don't last long enough and charging can be an issue,the weathered man,3,"I've had my Pixel Buds A series for a couple months shy of a year. I've really enjoyed them and use them every day when I'm cooking breakfast. They might get up to 1 hour a day use from me. The sound quality is very good, they are comfortable in the ears, and I like how well they work with my Pixel phone. I like the appearance, charging case and fit/finish of these more than AirPods.Recently the left earbud lost at least 50% of its volume, and is fading more every day. It's the same thing that happens with cheaper wired earbuds after a few months... volume loss, then eventually it stops working all together. So I was disappointed that the same thing seems to be happening with these Pixel buds, which are not cheap earbuds. I take care of my earbuds and keep them clean and free of debris, so that's not the issue. Apparently these aren't built to last. I had expected these to last as long as AirPods, but that's not been my experience.One other issue I've had with them is that often when you place them back in the charging case, they don't charge. Next time you go to put them on, they don't work because they will completely discharge on their own. Apparently there's an issue with the earbud's charging pin making contact with the one in the charging case -- it doesn't always make contact. Thankfully, the case's LED blinks to let you know when it's detected the earbud and is charging it, but you just have to make sure you watch it. It often takes me a few tries before I can get it to work. This has been an issue as long as I've had these. It's only a minor annoyance and I suspect it's a minor design flaw that they'll eventually remedy in manufacturing.","Reviewed in the United States September 12, 2023",AE6VEADNLEN5YHTMN4MSR6IB75IA,TRUE,19,Color: Clearly WhiteStyle: Pixel Buds
R1DUGRZZG6J15N,B0BZ9WMLNQ,5.0 out of 5 stars Good sound,Cesar Cavazos,5,It meets all the expectations and specifications described,"Reviewed in the United States June 3, 2024",AF5N3JWMT3D6UEIYCB5EUGUOAJ4A,TRUE,0,Color: CharcoalStyle: Pixel Buds
RXH42R2M3ZEFQ,B0BZ9WMLNQ,3.0 out of 5 stars Ok,obdulio Demata,3,"I think the sound is ok, but the shape of the ear buds are not the best, it keep falling off and not fitting good, give 3 star because I think the could be better for the price","Reviewed in the United States June 19, 2024",AFIKD6RY4ZJB7ETWDCVQB3RI765A,TRUE,1,Color: CharcoalStyle: Pixel Buds
R213FHV6IHBP6R,B0BZ9WMLNQ,4.0 out of 5 stars Wonder.,Hailu Beyero,4,It‚Äôs wonder and fits your ears perfectly with different sizes,"Reviewed in the United States March 31, 2024",AHE2WQHBNVZFA5E5BIKK2ADEQH7A,TRUE,0,Color: SeaStyle: Pixel Buds
R39LCJAU16TUKB,B0BZ9WMLNQ,5.0 out of 5 stars Over ear buds,Sharon Rosser,5,"I can't seem to wear earbuds that fit in my ears, can't seem to find a set that fits. When I saw these on Amazon, I ordered two sets! The case is small, earbuds magnetically sit inside, fast charging, super comfortable fit, and easy to wear. Good noise cancelling and sound.","Reviewed in the United States May 2, 2024",AG6JHOA7SGY2QQQ3PPRUQAVYIRPA,TRUE,0,Color: SeaStyle: Pixel Buds
R3JM58PXFOT4YJ,B0BZ9WMLNQ,5.0 out of 5 stars Best wireless earbuds ever!,Beau Sala,5,I have bought dozens of other brands and they always never work or the audio goes in and out. I had no issues with these earbuds at all. And the range of how far you can walk away from your phone was incredible! Definitely worth buying.,"Reviewed in the United States May 3, 2024",AHMEDROHV3KBFXSJOQLXN6GH2PKA,TRUE,1,Color: Clearly WhiteStyle: Pixel Buds
R21L8ZSRJA13O8,B0BZ9WMLNQ,5.0 out of 5 stars Google wireless buds are the best,Donnie,5,Only Google :) best product on the market for crisp clear sound,"Reviewed in the United States May 28, 2024",AH2UCHESZ52Q7MMXQBJIKLJ6N4IQ,TRUE,0,Color: SeaStyle: Pixel Buds
R34NWY3QHWMB50,B0BZ9WMLNQ,3.0 out of 5 stars Did not realize that they are not noise canceling.,Michael Kowalski,3,"Ok for the price. Not noise canceling, not quite loud enough to overcome equipment engine noise, but ok.","Reviewed in the United States June 29, 2024",AEYWCWQGJU6TEOT6SQ2KQOQNZFSA,TRUE,2,Color: Dark OliveStyle: Pixel Buds
R1QZGQGRQAOG82,B0BZ9WMLNQ,5.0 out of 5 stars Good Value for Pixel Owners,MEE,5,"These buds a re a good value purchase if you have a pixel. I tried the more expensive pro version and while the noice cancelling was nice, they don't stay in your ear as well and they often stay connected despite being returned to the container. I would stick to the cheaper A series pixel buds.","Reviewed in the United States April 25, 2024",AGXKKVKPPVL4ZPY4OU55TVLEVUQQ,TRUE,1,Color: Clearly WhiteStyle: Pixel Buds
R4D2FIRMGE10B,B0BZ9WMLNQ,5.0 out of 5 stars I decided to try them,Rodolfo,5,"At first I dont have a idea about them, But after so much to think I decided to try them and the result surprised me. The sound quality and the bass is amazing. I didn't like to use in-ear earbud because They caused headache, but This google pixel are very comfortable. The app comes with more settings to setup their functions. The noise cancellation is good, the people hear me very well.Moreover, When I say : ""hey google"" and I am using my android phone, The google assistant responds fast and then I dont need to use my hands to use my phone because The voice recognizion works well and I can do calls to my contacts only saying theirs names. This function works well when The app have been intalled in your Phone.I recomend this product.","Reviewed in the United States December 26, 2023",AGPEIHFLGATTFOZUXYRRRIIAPECQ,TRUE,3,Color: SeaStyle: Pixel Buds
RV32YNFMV9MJY,B0BZ9WMLNQ,5.0 out of 5 stars Best earbuds!! Better than Airpods and cheaper too,Phlox,5,"Wow, I'm totally blown away by the Google Pixel Buds! These earbuds are a game-changer, especially with the noise cancellation feature. They easily block out all the hustle and bustle of the outside world, whether I'm on the subway or working in a coffee shop. It's like having my own little serene oasis wherever I go. And the sound quality is just amazing - the bass is punchy, the mids are crisp, and the highs are super vibrant. I love listening to music, taking calls, and catching up on podcasts with these earbuds. Plus, the battery life is really impressive. I can use them all day long and still have some juice left for my evening workout. And the charging case is so compact and convenient, I can easily slip it into my pocket and take it with me wherever I go. Google really nailed it with the Pixel Buds A-Series - they're the perfect combination of noise cancellation, clear sound quality, and long-lasting battery life. 10/10 would buy again!","Reviewed in the United States November 10, 2023",AGUXKEIRQVLWNAEQ4TZIAH5HS2VA,TRUE,4,Color: Clearly WhiteStyle: Pixel Buds
R1TJSNYLSR4TP5,B0BZ9WMLNQ,5.0 out of 5 stars Pairs well with pixel phones,Sashmitha Adithya,5,"Works well. Sound quality is good. No active noice cancellation. Feels durable. The charging case is solid, has a nice feel to it!","Reviewed in the United States May 22, 2024",AHO3M5P7FL5QCTA44XUZUS3D2ZNA,TRUE,2,Color: Dark OliveStyle: Pixel Buds
R12VZA8MI6R6GL,B0BZ9WMLNQ,"5.0 out of 5 stars Great Pods, Better Than Many!",Mitch R,5,"I went through AirPods, Skullcandy Pods, and Galaxy Pods over the course of a few years and wanted some with good audio quality that weren't too overpriced. These Pixel Pods are perfect; they fit great, have awesome listening quality, and charge super quickly. My only complaint is that there is NO app for iPhones, so I'm not able to regularly update them or fine-tune them like I'd be able to on an Android. But, they pair just fine via Bluetooth and I have had no problems with them (or the need for an app). Definitely recommend :)","Reviewed in the United States March 6, 2024",AFWEFEQOWM3UCQSEHYWOXQQ2DP3A,TRUE,4,Color: Dark OliveStyle: Pixel Buds
R18MI5ZKPF044Y,B0BZ9WMLNQ,"3.0 out of 5 stars Nice sound, but they broke after few months",Angelica,3,They didn't work after a few months,"Reviewed in the United States July 2, 2024",AGQ3KH7KVLPHLS73HPTASD3BOMFQ,TRUE,1,Color: CharcoalStyle: Pixel Buds
R1OO23BPZB85N4,B0BZ9WMLNQ,"4.0 out of 5 stars Great sound and call quality, but difficult to pair",Clara,4,"I bought these because I tried some cheaper versions of Bluetooth earbuds that were not adequate. I've really enjoyed using these. I have unusually small ears and they hurt after a while if I haven't had them in. If I wear them a lot, my ears get used to them. I love that they have the little wing to keep them in place so I don't have to worry about them falling out! My only complaint is that they can be difficult to pair. There is a really specific process you have to follow and the earbuds have to be placed a certain way so they are connecting with the case the right way in order to pair. Make sure to get familiar with the instructions! You also can't control the volume if you are connected to a PC which I found really strange.","Reviewed in the United States July 24, 2023",AE45IY2JVXGSGDLUTXJK2ICMOXCQ,TRUE,6,Color: SeaStyle: Pixel Buds
R15JA925H18HFP,B0BZ9WMLNQ,5.0 out of 5 stars Yes please.,Fiddleleaf,5,"I love these earbuds. I LOVE THEM.I've always been an over the ear earbuds wearer. I hate inner ear earbuds. They've never been comfortable for me, and my ears have always hurt after wearing them. I've tried different sizes to make sure the fit was good, but it just never felt right in the past.I received my first pair of earbuds for free from Google with the purchase of one of their phones a year ago. I was super skeptical, but hey. It was free.When I tried them on, I was so surprised. They were comfortable, and they actually stayed in my ears. They didn't fall out. The grip was strong, but it didn't feel like I was wearing anything at all. After I tried wearing them on a few walks with my dogs to make sure they didn't hurt my ears from prolonged use, I was super happy with the results. No discomfort. No pain. Heck yeah! These were my new favorite earbuds.Six months later, I left my earbuds out on the coffee table while I was doing some cleaning. When I came back in, I discovered one of my dogs had gotten them and chewed them to pieces.So here I am. I immediately came to Amazon and bought a new pair on the spot, because I need these in my life. I got my new pair, and they're still as comfortable as ever.5/5, don't leave them near your dogs.","Reviewed in the United States April 7, 2023",AGNEEFBKM3UREFXD4DZTMSCBGO3Q,TRUE,37,Color: Dark OliveStyle: Pixel Buds
R340C9EVEY8GIA,B0BZ9WMLNQ,3.0 out of 5 stars Love me some Google | Poor charge,Lydia Seiders,3,"Love me some Google, especially Pixel! However, these buds were sort of a let down when it comes to the buds holding a charge. I can't get through a workday of meetings without my buds dying. Total sad face. But otherwise, the sound is smooth with the bass hitting just right for a broad selection of genres (although I don't listen to country), the fit is nice, and the setup is super easy once you get the hang of it. I can easily switch from my phone to laptop with ease. The case doubles as a sensory tool during meetings or while out walking. Charging the case takes a minute but it holds a charge well once it's fully charged. I think I've been able to charge my buds 2 or 3 times before needing to charge the case again.Buds seem to last longer during phones calls than meetings (thinks zoom) or listening to music (think YouTube).Noise cancellation is good! Especially if listening to something. If using as earplugs, the sound is more muffled than cancelled though.If you don't mind recharging your buds often, I highly recommend. I still highly recommend because the sound is worth every penny and the setup is so easy across multiple devices.","Reviewed in the United States October 22, 2023",AGEFG6MUBSCIMMLTTJHTJYJEWTMQ,TRUE,3,Color: Dark OliveStyle: Pixel Buds
RTTJWK7A53CAF,B0BZ9WMLNQ,"3.0 out of 5 stars they're OK, was expecting better from Google",V,3,"The sound is good and they're comfortable, but they have a tendency to fall out when leaning forward (like 90 degrees or more) and they take a looong time to pair. Up to half a minute. The extremely budget no name headphones I was previously using paired within seconds and always stayed in place.The controls are also not very reliable and sometimes I need to disconnect and reconnect them to get the pause/unpause to work. I use a pixel phone and have tried re-pairing them scratch but this problem persists.The battery life is closer to 4 hours instead of 5. I like the size and shape of the case, which is mainly why I'm keeping them, since the other earbuds I was considering all have very bulky cases that would be uncomfortable in a pocket. I'm glad I got them on sale. They don't seem worth the full price.","Reviewed in the United States January 30, 2024",AHAPA25V3RSJUPUFP5Z73JF7ONFA,TRUE,2,Color: SeaStyle: Pixel Buds
R1G8KOA05JPKAU,B0BZ9WMLNQ,3.0 out of 5 stars Not as described.,I am Steve,3,"I bought these because everyone said they were a good alternative to the Sony XM4's I had (their batteries died). These are not as described. For starters, the sound is tinny and not as rich as others. Even my cheap Raycons have better sound. These also are advertised as having good noise canceling. News flash... they don't have Active Noice Canceling at all!. Even with the largest ear buds on them, and the sound turned relatively high, I can still hear everything around me and there is no setting in the app to activate or adjust ANC. I was going to use these for a while and if they were good, upgrade to the Pro's... but these don't pass muster. Once again, the Raycons come in first place because they have pretty good ANC.Now you may ask ""If the Raycons are so good, why buy these?""The Raycons are push button and when I want to do things like change songs, I have to push the buttons and it pushes them harder into my ears. Also, the call quality suffers because people in the other end can't hear me very well. With these I never got to the part where I tried the call, but there was no point. If I don't like the audio, the call quality won't matter.These are cheaply priced for a reason.","Reviewed in the United States August 8, 2023",AH3DASADOTFMAVMTKHRFGCBEJQYA,TRUE,1,Color: CharcoalStyle: Pixel Buds
RB8GM0WFWF7S1,B0BZ9WMLNQ,3.0 out of 5 stars Right bud stopped working...,Amazon Customer,3,Loved these but wouldn't buy again... On the plus side- Sound quality is really good and these buds actually fit my ears... However I am very disappointed. The right bud stopped working after 7 months.,"Reviewed in the United States May 21, 2024",AE6TEGRB565PPDETK2MUTCWJ3DBQ,TRUE,5,Color: Dark OliveStyle: Pixel Buds
R2NNCMYYDQT730,B0BZ9WMLNQ,4.0 out of 5 stars Good,dolphin1,4,They're good. Kinda big for my ears. They are loud. But tbh you could get the same quality cheaper.,"Reviewed in the United States February 2, 2024",AFET2ZZ5CBQLUYHKWPFJQW52BXEQ,TRUE,0,Color: Dark OliveStyle: Pixel Buds
R2F8AQ4XOBT6PK,B0BZ9WMLNQ,5.0 out of 5 stars GET THESE!,Incredible kluH,5,"I was skeptical because of the price but I love them! I got the pro a few months ago and wanted to have one pair for work and one for the gym but didn't want to spend the price for the pro twice. Wish I'd gotten these first as they definitely suffice! Good overall sound, good bass as well without being too much. And I listen to everything from Rap, to metal, symphony, R&B etc. Hey... I said ""everything"" right? Lol","Reviewed in the United States February 24, 2024",AH4QBMSY7IKPNXSQOIIOSR3O2FWA,TRUE,1,Color: CharcoalStyle: Pixel Buds
R1T0I2T7E3YH1L,B0BZ9WMLNQ,4.0 out of 5 stars Pleasently surprised,daniel,4,"I've tried earbuds before and was reluctant to give these a chance but well, I did and I'm happy now.I had issues before with sound quality, comfort, connectivity, and earbuds falling out. None of that with these. I should clarify that everyone's ears are somewhat different but this has been my experience so far.I have to speak a bit loud on calls. Sound is good and clear. Music sounds good too but don't expect much base, it has more of a balanced style.The charging case is small and light, has really strong magnets. It doesn't feel particularly sturdy but does not feel overtly cheap either.","Reviewed in the United States August 28, 2023",AHSW62OZ5VFD3APH4UUIFPYSLDZQ,TRUE,3,Color: Clearly WhiteStyle: Pixel Buds
RL5GSQOXOYOQ5,B0BZ9WMLNQ,5.0 out of 5 stars Winner,Mike,5,"I had lost my Echo Buds recently. It‚Äôs kind of a good thing too. Even though the sound was great on those, everything else was junk. I got these Pixel Buds for $30 off as a nice replacement. I don‚Äôt have an Android phone, so there is somewhat limited functionality.Case-The case is nice and compact, Echo Buds are big and bulky and there‚Äôs always a weird bulge in my pocket.Fit and function-Its kind of subjective, but the Pixel buds stay firmly in my ear and I don‚Äôt have to stuff them in like the Echo buds. They just feel intuitive and natural. I find them easy to work with. The tap/pause works, and I never have to readjust them, and have my music constantly paused.Battery-These beat the $&@;: out of any earbuds on the market by at least double. I haven‚Äôt tested the battery myself yet, but 8-10 hours is A LOT of music!Sound quality-Google nailed it. The sound quality is at least on par with AirPods. The bass is strong but not overpowering, and the voice and midrange are crystal clear. Sure it doesn‚Äôt have spatial audio like Apple‚Ä¶who cares?I don‚Äôt have an Android phone, so I don‚Äôt have the Google Assistant. I plan to change that soon. Google dropped the gauntlet on Apple. They beat Echo Buds hands down‚Ä¶but that‚Äôs not hard to do anyway. Google wants these to be the AirPods for Android. I would say they‚Äôre succeeding.","Reviewed in the United States November 18, 2022",AFXS2AOYHJAQYYIRM36AUQF6PAHA,TRUE,22,Color: Dark OliveStyle: Pixel Buds
R3J2JU5YD3SUAL,B0BZ9WMLNQ,5.0 out of 5 stars Amazing quality,Andrew M.,5,I purchased a refurbished set and they are like new. The only thing is I had to do a factory reset because it still had the previous owners name attached to them. But after I did that they were like brand new earbuds.,"Reviewed in the United States April 14, 2024",AHRUJR7CSHBJLCFJJYECHRWO7QWA,TRUE,0,Color: SeaStyle: Pixel Buds
R1U59922CSSVGU,B0BZ9WMLNQ,5.0 out of 5 stars Feature packed at an awesome price,Cody,5,"After many different pairs of Bluetooth headphones from Jaybirds, to V Modas, to JBL I finally made the switch to the true wireless with these headphones. Sound is great for a vast majority of users (but not quite audiophile level) and these have great features. The auto pause when you take them of your ear, google assistant and touch buttons, automatic volume control based on ambient noise are all thoroughly enjoyable and helpful. Definitely make sure you download the app to get the most out of them.I do use them for music, videos, voice, and video calls and have great results with Windows, Mac, and Android. Battery life isn't the most stellar and I do run out of juice when using continuously for 3 to 4 hours between music and calls. But at this point I normally find that my ears need a break anyway and the buds charge rapidly in the case so they have enough juice to keep going by the time I'm ready to throw them in again.I also paired the sage color buds with the leather case from Nomad, and the pairing makes this product look and feel like a luxury product.I can't say how happy I am to have such a large company trending towards making modern tech more affordable. Google really exceeded expectations for me at this price point, and if you wait until they're on sale it feels like an absolute steal.","Reviewed in the United States December 23, 2022",AFIFQCABCY4W4JD4ZJMHVWEW75LQ,TRUE,22,Color: Dark OliveStyle: Pixel Buds
