review_id,product_id,title,author,rating,content,timestamp,profile_id,is_verified,helpful_count,product_attributes
R2LE3YBTCCKD13,B0C1QWWZR4,4.0 out of 5 stars Easy to fall out,John,4,Battery life and everything is good just falls out a bit but all and all good,"Reviewed in the United States May 7, 2024",AHEUUZ5UFSFO52BZ5UZJFUCEVB7Q,TRUE,0,Color: BlackSize: SmallPattern: Earbuds
R1EX31TUTVW12Y,B0C1QWWZR4,5.0 out of 5 stars Actually very good!,Kathleen Corrente,5,They are a good second pair with good sound. they are well worth buying them!,"Reviewed in the United States July 7, 2024",AGZ6IL476RIFTMAWHNDM36V25CXQ,TRUE,0,Color: WhiteSize: SmallPattern: Earbuds
R1PM8XR6N66HJO,B0C1QWWZR4,5.0 out of 5 stars Mastering Engineer Approved,Jenn,5,"A lot of pros with one con.I didn‚Äôt think I had a lot of time for earbuds during the day, so I started off trying a cheap pair. They were $20 or something with 4.8 stars and reviews like, ‚ÄúI haven‚Äôt used my Airpods since buying these!‚Äù so I thought that sounded perfect.They sucked. The sound was harsh, they became painful after extended use, noise cancelling was barely noticeable, etc. I can‚Äôt actually remember all of the problems at this point. BUT they sold me on the functionality of wireless headphones.Fast-forward to a few months later - it‚Äôs Black Friday and I bite on these because they‚Äôre on sale. I was a little hesitant because they had a lowly 4.2 stars. Turns out average reviews aren‚Äôt everything.These are the polar opposite of the highly-reviewed, cheap headphones I tried: they‚Äôre comfortable, and the sound is amazing. As the title implies, I master audio so this is not a hollow endorsement. The cheap ones had hyped bass, missing mids, and painful presence/treble. These are very flat and well-performing by comparison, and can be EQ‚Äôd. The noise cancelling is also VERY respectable. I frequently work around loud sources and am sensitive to loud noises, and I have accidentally left these in when I intended to swap for earplugs, because the performance is similar.I love the app. Being able to select between audio quality vs. video sync‚Äôing is awesome when I want to watch live musical performances where sync issues play with your mind. Being able to create custom EQ settings is very important to me too.The con is that you have to take them out of the case to power them on. It‚Äôs not a huge deal - it‚Äôs easy to pop them in for a split second if they‚Äôve timed out or something. But there has been one occasion that I ran somewhere and forgot the case. I intend to live my life without dependence on crap like headphones, so no big deal - take a break.I would normally give something like this 4 stars because that power-on function is a notable miscalculation on JBL‚Äôs part, but it deserves a much better average review than it has so I‚Äôm doing my part to raise it. In everyday life it‚Äôs not that big of a deal unless you‚Äôre the kind of person who loves to find things to complain about.","Reviewed in the United States January 12, 2024",AFO7HNFRBAYYCEYUNPA4KKJ3ZWTA,TRUE,104,Color: WhiteSize: SmallPattern: Earbuds
R31B38SJR4GZ9A,B0C1QWWZR4,5.0 out of 5 stars Under rated!,Nicole Crook,5,"The battery life, the comfort, the sound, the price?? All amazing. I‚Äôve had AirPods, skull candy, so many earbuds and headphones it‚Äôs wild. These are amazing and they fit in my (small) ear canals so well!! They don‚Äôt fall out like literally everything else.","Reviewed in the United States July 30, 2024",AHLVR55IPRHCFRXZLN6XZPQECMZQ,TRUE,1,Color: PurpleSize: SmallPattern: Earbuds
R3NH25H9DZE73F,B0C1QWWZR4,"4.0 out of 5 stars Good earbuds, not fantastic",Frank,4,"I use many different earbuds and headphones. These JBL Tune buds produce a good sound with my iPhone, especially when using the JBL app which has preset equalizer settings for different sounds and can deliver amazing base. Overall these are fairly good earbuds at a sale price of around $50. The box includes 3 pairs of silicon tips, small, medium and large, the silicon material is too smooth and too thin, they slide out easily and do not sit very securely for me, but this is very subjective and can be different for everyone. The noise canceling is only ok, in my opinion it provides about 40-50% background noise cancelation (personal opinion, not scientifically measured). The sound quality is very good but it seems the volume level seems low compared to other buds I have. The microphone seems to function well, I have not heard complaints from people I have called so I assume it is good. Overall, pretty decent buds but not fantastic, I was expecting more as a JBL brand","Reviewed in the United States January 11, 2024",AHBG72M7T2OPSJXFQKNNWHLKSEUQ,TRUE,31,Color: BlueSize: SmallPattern: Earbuds
R36AM1L7ZQ8OK5,B0C1QWWZR4,"5.0 out of 5 stars Fantastic sound, great battery life, a great buy!",TheRevenite,5,"I bought these on the Black Friday sale and man, I'm so glad I did. I have several pairs of the lesser Vibes, which sound good, but these blow them out of the water.First, let's address the fitment. I see many say they don't fit, they fall out, or feel like they're going to fall out. Don't put the large ear pads on if you don't have large ear canal openings! This will cause the earbuds to push themselves out. Too large will push them out, while too small will obviously not have enough to grip your ear. Test them all to find the right fit, if not, reach out to JBL, I'm sure they have replacement pads of other sizes. You can also buy them here on Amazon as they're pretty universal.I find pushing them in, and turning them into place, with the proper pads, netted a great seal and no falling out.You HAVE to install the app on your phone; otherwise, you're getting the flat sound your phone manufacturer decided sounded good. The JBL app is available for Apple and Android - and it makes a massive difference, especially with the noise cancellation and frequency response.With these, I'm hearing songs I've listened to for decades for the first time. I'm hearing effects and instruments I never heard in the music. These are that clear. They also don't kill my ears! I've tried earbuds from $5 to $300, and while the more expensive ones sounded terrific, they hurt my ears physically. With these, I get great sound and a great fit with a tremendous battery life.I'm reading a lot of negative reviews where either the fit or the sound is the problem. Most of these would be positive if people were provided with either longer pads so they go a bit further into the ear and more sizes and those with sound complaints would actually install the app. Mine sounded horrible with the Dolby equalizer baked into Android 13. Installing the app AND turning off any phone equalizer or sound enhancer was the solution. I'd definitely buy these again!","Reviewed in the United States November 29, 2023",AHRX7NNP5PFTRE7ODNC2FV7G3Q3Q,TRUE,95,Color: BlueSize: SmallPattern: Earbuds
RSLI1PRJFN6V2,B0C1QWWZR4,5.0 out of 5 stars Buy them now!,NellyNell,5,"These buds are amazing. I reviewed a bunch and decided to go with these and I'm so happy with my purchase. The battery life is amazing! They sound incredible! The noise cancelation works so well! The buds fit very good in my ears, and they are light Weight! I got the purple ones so pretty! And when I use for phone calls, people actually hear me nice and clear!","Reviewed in the United States August 5, 2024",AHL46MFPLVN5K6G2MDZLPDQDQF4A,TRUE,0,Color: PurpleSize: SmallPattern: Earbuds
R2WL9P4BFCQGGV,B0C1QWWZR4,3.0 out of 5 stars 3 stars for the price,Andrew,3,"Would have gave it 1 but 3 stars for the battery life and the fact that it gets the job done. It ain't the best ear buds, sound is decent. Noise canceling is bad, and its ability to stay in my ear compared to previous ear buds (WF-1000XM4) I owned is terrible. This ear bud wants to hang out as far as possible to the edge for me to keep pushing it back in and when I do it hits the touch sensitive surface and does all kinds of stuff. I ended up changing the silicone tips to what I'm comfortable with and it doesn't make a difference. The design is nice but thats all it is ""nice,"" and inconvenient compared to what I expected.","Reviewed in the United States July 11, 2024",AF3NCQKUIHWA73W45DVJDU6HADKQ,TRUE,0,Color: BlackSize: SmallPattern: Earbuds
R18F32XQ9FU4XG,B0C1QWWZR4,5.0 out of 5 stars Finally found decent performing earbuds,Photographer,5,"My standard for headphones is fairly high. I have a few pairs of high-end (also expensive) wired headphones for indoor, critical listening. I also have a pair of inexpensive earbuds for exercise. The sound quality is obviously subpar. I have been looking for a replacement.I bought and returned many over the last couple years; none lived up to my standard. Most of them had poor sound quality. I did buy one pair last year that was decent, but it had connection problems. So I returned it.I pretty much gave up until I came across this one. The price was too good to pass up. It was delivered not quickly, but within the promised time frame. Given my experience, I have low expectations. But the JBL brand name does give me some hope of acceptable quality.BT Connection was fast and secure with no problems so far. Sound quality is much better than I expected, especially for the price. While the sound stage is not as open as my high-end wired headphones, imagining is excellent, which I did not expect. Tonal balance is also excellent with no treble fatigue or excessive bass; I set the equalizer to neutral flat. I can wear it for prolong periods. I like it enough to wear it while moving around the house.","Reviewed in the United States July 19, 2024",AES7SSQNH3WNT4EAPENHZ67TRHBQ,TRUE,1,Color: PurpleSize: SmallPattern: Earbuds
R2XXJ5L8RAPC8M,B0C1QWWZR4,3.0 out of 5 stars Wanted to really like these,Jason,3,"Pros:Reputation Brand NameGood sound with JBL Headphone appPlenty of bass with JBL Headphone appCONS:FitBluetooth disconnectsI purchased these after mt galaxy bud 2 died, due to one bud falling out into my pool last year then finally died about a month ago.My primary use for ear buds is listening to music while doing yard work (mowing, weed eating, edging) and during pool maintenance (brushing the walls and vacuuming).When I first received these, I downloaded the app and they paired nicely with no issues. Capsule charge was at 75% while both buds were at 100%.Next I tried placing them in my ears. When i placed them in my ears and turn them counterclockwise the weren't very comfortable and felt loose like they were going to fall out, however they did say in place when i tilted my head to either side and shook my head. These earbuds are supplied additional ear cushions. I tried the bigger ones and for my ears these were too big for my ear canal and would not stay in very well. I tried the smaller ones and these wouldn't hold in place. I'd like to say they were like Goldilocks and the 3 bears, but none were just right. The closest for me were the medium size, but I still didn't trust them staying in while doing yard work.Today was the first day I've had to really put them to the test. I place them in and fiddle with them for a bit to get a ""snug"" fit. The only way I could achieve this was by turning them so that the J in the JBL logo was at about a 180 degrees facing upwards.I started Spotify and proceeded to start the yard work. I noticed myself constantly fiddling with the earbud, because the kept feeling like the were going to fall out, enough so that I kept activating the voice pass through.After about a hour and a half into the yard work I was met with a bluetooth disconnected message. When I looked at my phone (Samsung galaxy s23 ultra) it showed bluetooth was enabled and the buds were paired. I started Spotify again and the music resumed. So I was like ok????I did about another 2 hrs of yard work and they stayed connected, but I still constantly felt they were going to fall out.With today's experience, I will not be using these near my poolWould I recommend these to a friend? Probably notDo i think these were worth what I paid for them? No, with the fit issue, these should cost closer to $19.99","Reviewed in the United States May 11, 2024",AFSOFWNXPJRSNDJGDF5W3Y7PHWQA,TRUE,10,Color: BlackSize: SmallPattern: Earbuds
RVCGLXQ6QPIOT,B0C1QWWZR4,5.0 out of 5 stars I highly recommend these for the best affordable options,Miguel Paula,5,"Now only 1 complaint I have coming from someone who‚Äôs switches headphones a lot and literally tried all mainstream brands. Especially all Bose, which piss me off I returned my Bose quiet comfort because it always fails to connect to one earbud and I have to go and put the headphones back in case to get them to sync well. iPhone and android. Now these I never had this issue. Over a wake they sync perfectly. Sounds amazing. Don‚Äôt feel them at all. So light. Now the complaint is the noise cancellation isn‚Äôt the best. It cancels about half the noise. But I don‚Äôt mind it because when the cancelling is too strong they give me a headache and I feel my eardrums are going to be sucked out. Highly recommend these I was sleeping on JBL FOR YEARS.Forgot to mention important. Very fast tap response. Which baffles me when I used the Bose to get it to aware mode and noise cancellation I had to hold it for 2 seconds which was so annoying. Don‚Äôt get me wrong I love Bose they have the best sound to me but I‚Äôll stick to home theatre and maybe over ear headphones","Reviewed in the United States August 6, 2024",AH4ERYI5VWISIF5IF7E3ZEUIBFJA,TRUE,0,Color: BlackSize: SmallPattern: Earbuds
R297TPWIHGDRQG,B0C1QWWZR4,4.0 out of 5 stars Comfortable fit and good quality,Dianna P.,4,"I use them on the tread-mill and for doing basic exercises. Lots of Bass, BUT ONLY if you download the app. Great quality of sound and they fit perfect and come with two extra-ear fittings for your ear. These earbuds come in different colors and I chose blue.All-in-all, would buy again as the price to quality ratio is very good. The noise canceling option for these is the best I have ever heard. Its has 3 settings of noise canceling and I was super impressed. Standing next to my AC window unit I could not hear it AT ALL on the max setting. Worth buying for sure.","Reviewed in the United States July 17, 2024",AG3FHXNJVVMLHL6OZNGN6P3YQ44Q,TRUE,0,Color: BlueSize: SmallPattern: Earbuds
RF3YJK1VIQ311,B0C1QWWZR4,5.0 out of 5 stars I love it,Arthur,5,I love it get you one,"Reviewed in the United States July 14, 2024",AF6K5FQT5WHABK2OZVSOHMTNI5BA,TRUE,0,Color: BlueSize: SmallPattern: Earbuds
R2K9RWQESU44R,B0C1QWWZR4,4.0 out of 5 stars Meh...,Marilyn,4,Good sounding but won't stay in ears. Every turn of the head and they fall out. Decent noise cancelation if they would stay in ears.,"Reviewed in the United States April 28, 2024",AETIH2L4KIXAULAAVZ4KQ2R2NBRA,TRUE,0,Color: BlueSize: SmallPattern: Earbuds
R1CB1TDUHI9QOZ,B0C1QWWZR4,5.0 out of 5 stars Ear buds,Ada Lee McPherson,5,Bought them for my grandson and he loves them. I know he cannot hear any outside noises because I have to touch him in order to get his attention. The sound canceling feature works.,"Reviewed in the United States June 21, 2024",AGRLS5DO2XBVTS23X5S7Y4JPOQOQ,TRUE,0,Color: BlackSize: SmallPattern: Earbuds
R3F50MAAPBCS56,B0C1QWWZR4,4.0 out of 5 stars Good Quality,Los gatillos son muy inc√≥modos y duros de presionar.,4,But the calls are uncomfortable to hear.,"Reviewed in the United States May 16, 2024",AH535EZ6ZVTN46CL4E5POVIPT7XA,TRUE,0,Color: BlueSize: SmallPattern: Earbuds
R2W357CPXUJ9ZX,B0C1QWWZR4,3.0 out of 5 stars Quality great but doesn't sit in ear well,Jaime,3,"Love the quality and the battery life the only thing I'm not happy with is how it sits in the ear. Changing the size doesn't help either. The buds are too heavy and should have a wrap around the ear for more support. If you don't plan on moving, chewing, talking then these are great. Otherwise get ones that wrap around your ear.","Reviewed in the United States July 10, 2024",AFBVO2IAZVRMF7QLDBCCL4U5C3YQ,TRUE,0,Color: PurpleSize: SmallPattern: Earbuds
R3BGODHOQ5JGCR,B0C1QWWZR4,3.0 out of 5 stars The sound is not great,Luanne Leyla Lyell,3,"I was very disappointed in the quality of sound coming from these buds. I have gotten JBL ear buds in the past (that were tethered and stayed in my ears very comfortably) and the sound quality was excellent at half the price of this pair. Also, I can;t get them to stay in my ears as I walk. They continue to get loose and fall out or if I try to press them back they go on and off repeatedly. It's very irritating. But the quality of sound is terrible. It sounds like an AM radio with no stereo. Not really happy with these at all and feel like I've completely wasted my money. I'm a disabled veteran and I can't afford to get others.","Reviewed in the United States May 25, 2024",AEXCTPINXIPPRLGNDZATHEWAWPDQ,TRUE,0,Color: BlackSize: SmallPattern: Earbuds
R3VYZ16KPGIAMK,B0C1QWWZR4,3.0 out of 5 stars They are ok - no in between with the sound,7121,3,These fit better than the other JBL pair I have but there isn‚Äôt an in between with the sound quality it‚Äôs either really loud or two low. You have to put the volume almost all the way up to hear anything. They also aren‚Äôt noise cancelling like it says .,"Reviewed in the United States July 17, 2024",AHRLITTVP7HKUKCDNZRQIK5EYTZA,TRUE,0,Color: BlackSize: SmallPattern: Earbuds
R19HIOK5ESCM3F,B0C1QWWZR4,5.0 out of 5 stars Pretty sensitive to the touch,Felipe Guzm√°n great. Buy the sound it‚Äôs grat,5,Sounds great. Good bass,"Reviewed in the United States July 12, 2024",AFKUJCONSZH2XETULXZ47H37SIZA,TRUE,0,Color: BlueSize: SmallPattern: Earbuds
RTTC724K789G2,B0C1QWWZR4,5.0 out of 5 stars  Great product I recommend it,fabiana,5,Super easy to use and I love it;),"Reviewed in the United States July 7, 2024",AGN67XUTIUEOQU7HMG4L47RQCC2A,TRUE,0,Color: BlueSize: SmallPattern: Earbuds
REZ2THYW863CB,B0C1QWWZR4,4.0 out of 5 stars Nice Earbuds,Gene Kohout,4,Sound is great and all functions work well. A little awkward balance while in my ears during gym activity so occasionally need to re-seat them.,"Reviewed in the United States April 15, 2024",AE7Q4Q72YTH6SCSBSMMOBHNQPGEA,TRUE,1,Color: BlackSize: SmallPattern: Earbuds
R2PEVYQEC24SFX,B0C1QWWZR4,"4.0 out of 5 stars Good sound, but they don't stay in my ears",DanGra,4,"The sound is good, the battery life is great, but I can't get them to fit my ear, I have to be constantly adjusting them because they get uncomfortable with the slightest movement.","Reviewed in the United States April 6, 2024",AE3WYAZI7W5M6H5J6GBESFWEX7LA,TRUE,1,Color: BlackSize: SmallPattern: Earbuds
R27IXJDY14S5,B0C1QWWZR4,4.0 out of 5 stars Great sound quality!!!,Klopfenstein,4,I‚Äôll admit I‚Äôm old-school. I like my headphones covering my ears to seal out surrounding noises‚Ä¶‚Ä¶..That being said‚Ä¶.These JBL earbuds have wonderful sound quality that you can adjust through their app on your phone. The bass is fantastic for an earbud!!!!The fit is less to be desired. Its awkward at best and doesn‚Äôt stay installed. I feel the size(which gives you the deep bass sound) keeps pulling the bud out of my ears. Don‚Äôt recommend for active use.,"Reviewed in the United States February 19, 2024",AEUN7SLDN55Z6HW22F7DZFVYVL3A,TRUE,0,Color: BlackSize: SmallPattern: Earbuds
R1UB3DTXP99H9W,B0C1QWWZR4,"4.0 out of 5 stars Clear sound, with good noise cancelling.",Travis,4,"Easy to setup and get going. Came charged and ready to go. Sound quality is pretty good for the price and the eq feature in the app is nice. Bass sounds sharp if it not up too high, turn it up all the way and it gets a little bit uncomfortable. For my ears, I can't get a super tight fit but that's not a design issue as I've always had this problem, I'll try some foam ear tips later. I would recommend these if your looking for sub $100 earbuds. Sometimes very slight artifacts in sound quality with noise cancelling on, ambient mode is nice if I'm walking and need to hear what's happening around me. Able to hear and have a conversation if needed without removing the earbuds.","Reviewed in the United States November 27, 2023",AGGCQV4ACO6SGFE63SPE5VUWHHZA,TRUE,1,Color: BlackSize: SmallPattern: Earbuds
R1JXTVFJMESN8Z,B0C1QWWZR4,5.0 out of 5 stars Best Earbuds on Amazon,TheJohnsonFamily,5,"I am a music producer and Out of all the earbuds I‚Äôve tried, these were the best in every way. Connection is long, it charges the longest even over my Apple earbuds. Noise cancellation is great. Love them!!","Reviewed in the United States June 12, 2024",AHC2DGE6NH4YASOM54HO3JXJZJFA,TRUE,0,Color: BlackSize: SmallPattern: Earbuds
R2YFEGHZ5SOSVD,B0C1QWWZR4,3.0 out of 5 stars Good but with some issues.,"Value for Money, but not a great snuggled fit",3,"Sound quality is just above average at this price range, bass is sharp and to the point, not too much not too low. Mid and treble are the way it sounds perfect for the music, movie and podcast.But the issue is, it's not fit in ear perfectly, it tends to fall down from ear after some time specifically if your ear sweats.I also noticed while talking over the phone for a ling time, for the jaw movement it tends to come out from the ears. I twice face the issue and they dropped from about 5'6"" height and survived.Now, the Ambient sound mode is just a trash. Very little or no sounds are hearable from even 5ft distance. Talk through can help in that case, but talk through make the volume lower by default and can't increase at a certain level.ANC works fine at this price range, but a hissing sound is there and sometimes feels annoying while in between songs. But don't expect too much from this ANC.I used a similar product from Soundcore which is Sound Core life note 3i.The ANC and Ambient aware from that device is far better than this one for sure.","Reviewed in the United States January 13, 2024",AG4YCKW4BFTB5ZQYH7QNHJYF5CTA,TRUE,5,Color: BlueSize: SmallPattern: Earbuds
R2TAGKWTETLDW5,B0C1QWWZR4,5.0 out of 5 stars Love them!,Acer,5,"These earbuds last me dayss without recharging, they sound amazing and the noisecancelling is wonderous on them. The fit can take a bit to get use to (put smaller ear pieces on them so they can go in better is my tip) but the light weight makes it work! I liv all the button customization and controls< plus they stay cinnected to my phone even if im across the entire house.","Reviewed in the United States May 21, 2024",AGRQC5M5YJBXVQ34PSTAB7B5L55Q,TRUE,0,Color: BlackSize: SmallPattern: Earbuds
R3TSBTD5J96YHN,B0C1QWWZR4,3.0 out of 5 stars Falls out,Ryan,3,Sounded amazing and felt very comfortable but I bought them for running. They are designed to hover inside the ear so only the tip holds them in place. They loosen immediately and slip out.,"Reviewed in the United States June 22, 2024",AGHAZLWD6IH6EBMELFETA4GTVVXA,TRUE,0,Color: WhiteSize: SmallPattern: Earbuds
R298V2YQLPKQ6F,B0C1QWWZR4,"2.0 out of 5 stars Not as good as expected, lost one within a week.",Michael and Karrie,2,"Don't get me wrong, these are decent earphones. On par with the good sounding off brand $30 sets. Big difference is that they have features that help with ambient sounds and has noise canceling. Thing though is I was very unimpressed with those features after owning a pair of Bose earphones. These were also really lightweight/cheap feeling compared to my Bose, and weren't as easy to use with the taps and stuff. Then there is the fitment issues. Do they have different size rubber pieces? Yes. 3 sizes, 1 set of each. None of them worked, to the point that almost every facial muscle movement or jaw movement caused them to fall out. Personally I like to be able to talk when I'm on a phone call, but these made it hard to. And trying to watch a movie while eating? Impossible! I spent more time catching/picking up my earbud and trying to resume the movie than I did eating.Ultimately my advice is that if you're not wanting to spend a lot of money on features like noise cancelation, take a chance with an off brand for a third of the price and you'll most likely still have the same sound quality. If you want thise features and are willing to pay this price, spend a little more and get Bose or a good brand that knows how to to it right. If you want them to stay in your ears, go with literally ANYTHING else!Battery life was great though!","Reviewed in the United States May 30, 2024",AGWW26SKIF24XO4XCCNYNKU3VQDQ,TRUE,2,Color: BlueSize: SmallPattern: Earbuds
R37C2SFBAOF1YX,B0C1QWWZR4,4.0 out of 5 stars JBL sound,HomeBodies,4,"As expected, JBL delivers great sound. I use primarily for tv viewing to not wake the wife. Still trying to figure out how to mute commercials. Haven't gotten the tv volume on the remote to work with these buds yet.","Reviewed in the United States March 14, 2024",AGM3UTYRSWLKFBR3TLBI43SIMUFA,TRUE,0,Color: BlackSize: SmallPattern: Earbuds
R1NE6TH2NGXHRZ,B0C1QWWZR4,5.0 out of 5 stars The quality is good,Oscar,5,The sound clear,"Reviewed in the United States June 29, 2024",AHMTO73SB7GSXMNMK2UMDX3AJYJA,TRUE,0,Color: BlueSize: SmallPattern: Earbuds
R3QP56F4Z7CHLD,B09CKF166Y,5.0 out of 5 stars Great value,Luisa Bautte,5,"Loving my earbuds. Great sound, easy to answer calls, caller can hear you perfectly even when out in the street. Very happy with my purchase","Reviewed in the United States July 28, 2024",AHOULQSXJ4IHL3ECPVW4LKMGK2MQ,TRUE,1,
