review_id,product_id,title,author,rating,content,timestamp,profile_id,is_verified,helpful_count,product_attributes
R9Z8EU1WDJY8Y,B08ZR5JB9G,4.0 out of 5 stars The left earbud quit working completely and had to be sent to a service center.,Joe H,4,The left earbud quit working completely it would not communicate with any devices. It would not even communicate with Sennheiser‚Äòs smart control app. I had to send it to a service center after all kinds of communications with Sennheiser. They have a two-year warranty. Too bad Amazon does not honor the warranty. The good thing is you pay for shipping to the service center and then apparently Sennheiser reimburses you and after completing the service since you the earbuds back along with the shipping fee.,"Reviewed in the United States June 30, 2022",AHTZSZ7LDAT2F2W3IFAKODWROZ2Q,TRUE,4,Color: BlackSize: SmallStyle: True wireless earphone
R22QO30JRFM34F,B08ZR5JB9G,"2.0 out of 5 stars Sound quality is fine, but the design is just bad",Stephanie,2,"I‚Äôm not an audiophile, so the sound quality is fine for its purpose. No complaints there.The earbuds themselves though- I‚Äôve had them for a year, and my complaints about them have remained the same. The buds themselves are heavy, so no matter how good the fit in your ear, if you swipe them lightly with your hand they will fall out.And, I‚Äôm not sure if anyone who uses these earbuds has ever needed to adjust their hair or ponytail, but if you so much as brush the outside on the earbuds, it stops your music. Who thought a a sensitive touch plane spanning the entire exterior of the earbud was a good idea? I finally figured out you need to download an app (which is a totally reasonable thing to have to do for headphones?) you can turn the touch controls off. But it still makes a beep if you touch it. You have to be so gentle around these guys.None of it makes sense. There are less frustrating options out there.","Reviewed in the United States April 4, 2023",AFOHQ4XWPLHUC7XHT6OYORX4GSEQ,TRUE,0,Color: BlackSize: SmallStyle: True wireless earphone
R89N9KWCL50LI,B08ZR5JB9G,4.0 out of 5 stars Sound great and has excellent battery life.,e36mitchell,4,"These are not ‚Äúactive‚Äù noise cancelling, they are passive. Does enough noise cancelling to listen to music at reasonable volume in loud environment. Connects easy, app works well. Sound quality is pretty nice for the money. Right earbud quit playing sound after a few months, but with proof of purchase, sennheiser warrantied them with no issue. Not the most comfortable in ear headphone, but I‚Äôve been really happy with them.","Reviewed in the United States September 7, 2022",AEATWYJF6RIX5FI236EKEFUY5GYA,TRUE,2,Color: BlackSize: SmallStyle: True wireless earphone
R3BY2IEZTKLISI,B08ZR5JB9G,4.0 out of 5 stars Returning Bose. This has the best bass.,R. Moon.,4,"I have Been using Bose QC 35 which can‚Äôt be replaced. But I‚Äôm looking for earbuds now. It‚Äôs been a few hours since I‚Äôve been comparing these with the Bose QC and sports earbuds. Tried many songs. Bass, treble, vocals, just speech videos. These are compelling. Especially with equalizer with smart balance. Anyway, taking one star away because the alerts from both earbuds are out of sync most times. Which makes me worried whether this is going to be a problem in future. Another thing, I‚Äôm worried if my ears are gonna get sore by hours of wearing. They‚Äôre a little stuffy in the ears.But I‚Äôm definitely returning all other earbuds.","Reviewed in the United States August 7, 2021",AHE3L7LKFB7TNAVU74DW6UTMNWVQ,TRUE,10,Color: WhiteSize: SmallStyle: True wireless earphone
R1SIN4GO3W2Z90,B08ZR5JB9G,3.0 out of 5 stars Uncomfortable and instructions suck,Amazon Customer,3,"I‚Äôll start out by saying that the sound quality was definitely good. The instructions that came with it were Basic. Even then, a quick Google search got me what I needed to know. There were no mic problems. I might try the app just for kicks, but I think I need to return these. The one in my left ear was comfy, but the one in my right ear was irritating, even after trying different bud sizes. I couldn‚Äôt even finish 3 hours of work before taking it out. When I did, I set it on my desk which it mistook as a volume up request and blasted the left ear. These are solid but not for me.","Reviewed in the United States August 18, 2022",AEAC3BGGZLRLBQ5DYTQAVQTKQ6WQ,TRUE,1,Color: BlackSize: SmallStyle: True wireless earphone
R15SS8YU8XZZQV,B08ZR5JB9G,2.0 out of 5 stars Excellent sound but lousy reliability,Edward Smith,2,"I bought these based partly on the good reviews. They have a well balanced sound. Not heavy on the bass and great mid range clarity. My only issue with them is that one or both keep malfunctioning. One of the ear phones stopped producing any sound, so I sent them back for warranty service. The returned ear phones worked fine for a month, until one of them stopped working. I sent them back again for warranty service. The pair I have now are mostly OK, but occasionally, like today, one stops producing sound. I sort of ""reset"" them by placing them back in the case for a minute. So far that has worked - they both start working again. I have no idea if I've been getting replacement pairs, or if the original items were serviced. If they keep sending back the same pair then I'm just unlucky to have bought a lemon. If they are replacing the ear phones each time then there is a serious overall quality issue.I have one month left on my warranty and I worry they will fail for good after that date passes.","Reviewed in the United States September 9, 2022",AHWIAWC4IF2O4X34PPGXSEHJHUFA,TRUE,2,Color: BlackSize: SmallStyle: True wireless earphone
R3TEN3N9AZ3DMJ,B08ZR5JB9G,3.0 out of 5 stars Can find better headphones for the price,nima,3,"I expected much more from these earbuds from sennheiser. I am definitely not an audiophile but do have a lot of different audio equipment. Ended up changing these out for the sony wf-c500 and those definitely sound much better.Pros:-not too pricey-many rubber options-can be EQ'd but the app is not very custom and only allows specific frequencies and is a terribly designed appCons-Very bulky-Sound quality was nothing special, with a volume that did not get very loud and a very basic lows and highs. If you are someone who enjoys bass, these buds are definitely not bass heavy","Reviewed in the United States December 13, 2022",AG7M23CQFYFEGER44W7UH54BQDMA,TRUE,0,Color: BlackSize: SmallStyle: True wireless earphone
RUD29G7X9X0CP,B08ZR5JB9G,1.0 out of 5 stars Broke twice! Don't buy.,Kirk,1,"Like others here, my right earbud stopped producing sound after less than 3 months. I will try to warranty these things.---I had to pay for shipping, but they sent replacements in about a week.Well, now these broke in exactly the same way! I think after another two months or so.Don't buy these earbuds. You'll keep spending money getting them fixed.--- Original Review ---I'm afraid I'm experiencing distortion on these things that I don't on my cheap MDRXB55AP Sony earbuds.It's not on all audio sources, but too many. It's the high base sound right around the early voice range.Not always, but often enough.Look, I paid $25 for these cheap Sonys and they just sound better than these $80 Seinheissers.I'm on an S22 with the AptX codec running.My S7 with those cheap Sony wired earbuds produced better sound.Update: The sound is still the same, but I upped it a star, because these things are so convenient.I can leave my phone upstairs and walk around the whole house without losing signal.The battery life is very good too. Six hours? Then you can put the things in the charging case that has a battery in it to charge on the go.Each earbud operates solo if you need it.Comfort is so so. Took me awhile to get used to it. Now I sleep with the things on, but I use a wedge pillow. These aren't the best to sleep in, but it can be done with enough willpower. Lol!","Reviewed in the United States May 7, 2022",AF4QTM5LTIOV2MS6IWXXQUO467KA,TRUE,3,Color: WhiteSize: SmallStyle: True wireless earphone
R15TZMC2EX8C1L,B08ZR5JB9G,2.0 out of 5 stars Don‚Äôt waste your money on these,Hectorflo,2,I normally don‚Äôt write reviews but with these I had to. I want to first state these earbuds can be good! The features you get with these earbuds are great! But I don‚Äôt know where Amazon is getting the product from. Because I have had two pairs of these earbuds and they have had nothing but problems. With both pairs they wouldn‚Äôt charge and if I was able to get them charged then they would connect to my phone. And trying to rest the earbuds requires both earbuds to be charged and in the charging case. But that‚Äôs just the problem that‚Äôs my issue they won‚Äôt charge so some days I was just wasn‚Äôt able to use them at all. Overall very disappointing experience. But like i first said these can be really great earbuds but for some reason Amazon just gets them from a place that just doesn‚Äôt have them working properly. If you‚Äôre thinking about get these just consider buying them elsewhere. I hope this helped,"Reviewed in the United States January 16, 2023",AFTITECN2TEMNCYT2K5TSO7U2LOA,TRUE,0,Color: BlackSize: SmallStyle: True wireless earphone
R1D6YEZ28VZZDF,B08ZR5JB9G,"5.0 out of 5 stars Terrific sound, a tiny bit uncomfortable.",Dara,5,"I have a pair of Sennheiser over ear, and a pair of corded Sennheiser earbuds. I don't know why I felt the need to have wireless earbuds, but I bought them. The sound quality is super super good, and I don't know if the fact I have an Android is useful to anyone. The sound is deep, and super loud, and I can't hear anything above my music. I will be test driving them on an airplane to hear how well the noise cancellation works. I have only tried one size of the tips, so maybe they are a tiny bit uncomfortable because I have the wrong size. I will try other sizes soon. I think Sennheiser makes the best earbuds, and headphones, and so far I am super happy with this purchase.","Reviewed in the United States April 20, 2022",AGF57QYQ2GJ5O6EREJQBK4WTVUYA,TRUE,2,Color: BlackSize: SmallStyle: True wireless earphone
R1KOT9VQZRR9DP,B08ZR5JB9G,"2.0 out of 5 stars Great audio, horrible physical and software quality",Nina Roosa,2,"Sound great, well mixed, but constantly disconnect for no reason if you pause or buffer for more than 3 seconds and my left ear bud no longer works and doesn't produce sound after only 6 months","Reviewed in the United States March 29, 2024",AF6VWBZ64F5YUJ5XS6DAZBEMSHTQ,TRUE,0,Color: BlackSize: SmallStyle: True wireless earphone
R7OLS7G2YJHAH,B08ZR5JB9G,4.0 out of 5 stars Easiest set up ever,Kathy M. Togni,4,I just received these and am so pleased that connecting them to my Samsung Galaxy was very straightforward. I will write more about the other critieria as I use the buds.,"Reviewed in the United States March 28, 2023",AG6XHYMD5VHWAHHGWCJQ3SIIDPWA,TRUE,0,Color: BlackSize: SmallStyle: True wireless earphone
R3DKI3GEQQ9ZMC,B08ZR5JB9G,"4.0 out of 5 stars Sounds good, but quiet.",D.K.,4,"I've had these for a few weeks nowThey fit comfortably, and sound decent. I'd like more control of the EQ through the app, but you can only adjust 3 sliders.They do not get very loud. You can listen at max volume and still feel like you need 2x more. (I'm not deaf, I still have great hearing)They last a long time, but the charging case is pretty bulky.","Reviewed in the United States March 20, 2022",AFQV6CY4UKJUE2UNLCT5BVV7BNMQ,TRUE,1,Color: BlackSize: SmallStyle: True wireless earphone
R13VMP6ZDXAPUW,B08ZR5JB9G,"5.0 out of 5 stars Great sound quality. Instantly gratified buy, you won't regret this purchase",Jacob Handelman,5,"Easy to charge.Amazing sound quality- I really cant get past the rawness and dryness of the sound. I feel like I'm actually in the studio w/ the musicians hearing what the producers wanted me to hear. Live concerts (for an ex: Donny Hathaway Live) sound like you're actually there. Very magical experience, buying these, and I'm glad :) I did.Unique appearance, nice slick, black, shiny charging deck.Easy to use and easy to control.SMART- my boys' wicked smaht. Remembered the last settings I had on which bluetooth I preferred, and just repeated the commands to me. Amazing. Also using Siri.Good for writing music as well and Sibelius commands. I can hear all the notes properly simply because of the dry mix of the speaker in the earphone. What great sound.What a purchase! Thank you, Amazon for the recommendation.","Reviewed in the United States January 5, 2022",AHLE4LFXIVRKND4SFOGVKIJCMWQQ,TRUE,1,Color: BlackSize: SmallStyle: True wireless earphone
RXN7NJI0VBPG3,B08ZR5JB9G,3.0 out of 5 stars Insufficient instructions & bass,Bob Coleman,3,"I have used & loved Sennheiser headphones for decades because of their crisp, clean, full sound. I found these particular earbuds wanting in three ways:1- instructions were too abbreviated- I had to use trial & error to get them to work2- difficult, almost impossible to pair 2 sets at a time- our TV does not have bluetooth, also purchased Sennheiser bluetooth transmitter, so I thought pairing would be simple & easy- not for me3- the sound did not have enough bass for me- again, maybe it was adjustable, but I could not figure out how with the limited instructions","Reviewed in the United States August 15, 2022",AFV7HJPKQP3D5G654XCPMQJPREVQ,TRUE,1,Color: WhiteSize: SmallStyle: True wireless earphone
R3PMKLEN8T2D31,B08ZR5JB9G,4.0 out of 5 stars Amazing headphones,Alexis Najarro,4,"These are my first set of true wireless headphones and I must say it's a great start.Sound quality is a bit better than your average skull candy headset(which was what I moved up from). That being said, I know it says you're supposed to be able to receive and make calls on this but I haven't had good results with that feature so I don't actively use it.","Reviewed in the United States February 1, 2022",AEYSMCVORF26G5AHD4K2SW4H3YMQ,TRUE,1,Color: BlackSize: SmallStyle: True wireless earphone
R1JBQTP05FUBYC,B08ZR5JB9G,5.0 out of 5 stars Great for the price,DocBrown,5,"I‚Äôve been reluctant to go wireless, mostly because of sound quality issues of Bluetooth. But I really like the idea of being free from wires while at work, I already have phone/meeting headsets that are Bluetooth and love them. These went on sale Cyber Monday for a good price so I thought I‚Äôd try them.I found them a little bit of a pain to setup. The ‚ÄúQuick setup guide‚Äù was lacking information. Once I downloaded the full manual I figured out what I was missing and then got them setup and working with my phone. Sound is very clear and bass is excellent and not muddy. It does take a little tweaking of the EQ in the Smart Control app. Noise cancellation is very good considering its passive. These are generally comfortable but can cause a little fatigue if in for long periods. I‚Äôm in and out of meetings everyday so generally this is not a problem for me. I have found that I cannot position them the same in each ear. Everyone‚Äôs ears are different but unfortunately the only way to know is to try them. Battery life is good, though I stick them in the case when I leave my desk and the charge tops off on its own. Being Bluetooth, they do drain my phone a lot more than wired buds. I can‚Äôt comment on failed bub issues yet, it‚Äôs too early, so we‚Äôll see.I didn‚Äôt intend for these to be used with phone calls but ended up taking a few calls while wearing them. I was surprised at how good the voice sounded. Warm and no distortion. The person I was talking to said it was pretty good. She had no trouble hearing me.A few complaints in the reviews I noticed of which have fairly simple solutions.1) Lack of bass. Make sure you are using the correct size ear adaptor and that it is snug in your ear. This is critical. They have the medium on out of the box. They seemed fine, but after a couple of days I took a chance and tried the large. Wow, dramatically better. I also found you have to wiggle it just a little to get the maximum effect. Also download the Smart Control app to get a bit more bass from the EQ. I suggest trying the Sound Check component of the app.2) For the units that are prematurely dying, I wonder if the contacts are dirty. The full manual specifies they do need to be cleaned from time to time. Also, they do have a 2 year warranty but you have to contact a Sennheiser partner.EDIT: I mentioned above that I got a little fatigued with them in for a while. After pulling out a couple of hunks of ear wax with the right ear bud, I decided to try some ear wax remover. Not only do the bud fit better, they are more comfortable. Something to think about if you are experiencing discomfort.","Reviewed in the United States December 2, 2022",AFWLU4KB7AN2ZGSOS3HICOKC44SQ,TRUE,26,Color: BlackSize: SmallStyle: True wireless earphone
R1YXPTOD9CWT3I,B08ZR5JB9G,5.0 out of 5 stars Great sound at a good price,Ben W.,5,"I recently lost my AirPods on a trip and was looking for something to replace them. I didn‚Äôt want to pay what they wanted for the AirPod pros and I wasn‚Äôt really impressed with the sound quality of the AirPods, so I went looking for the best sounding sub 130$ wireless earbuds I could find. I settled on the CXs and received them today. I‚Äôll get to the sound quality at the end but first let me go over some other aspects. The set up was extremely simple, there are clear directions, I just pulled them out of the box removed the very obvious and labeled plastic covers on the battery contacts and then charged the earbuds for about an hour. Once they were charged they paired with my iPhone no problem I also downloaded the app which worked without issue. The fit is slightly less comfortable then the AirPods however they are not uncomfortable and feel quite secure. These buds lack ANC however I don‚Äôt think that will be an issue as they are very effective at blocking outside noise. The touch controls are intuitive and work smoothly. So far I have used them both together and one at a time and have taken them in and out of the case and have no issue with connectivity, you do have to reconnect to the app if you disconnect from Bluetooth however the app does have to be running for the earbuds to work, only if you want to run the equalizer also reconnecting to the app is very simple. The only ‚Äúissue‚Äù I have had so far is when I updated the firmware; everything went fine however be prepared to have your phone and earbuds tied up for about 40 minutes while the firmware updates; during this process the app needs to stay open and the earbuds need to be close to the phone. It‚Äôs a little nerve racking because I was worried if for some reason the update was interrupted it could brick the earbuds, that being said it went fine just took a long time(the app does give a fairly accurate countdown so that helps a little). So how do they sound? There is no doubt these are the best sounding pair of earbuds I have personally heard in my life. I‚Äôve owned the AirPods, the Jabra 65t, first generation beats, and a couple different Chinese pairs; none of those are even in the same category. These where the first earbuds I‚Äôve had that do not sound like music is just being pumped into my ear canals; the music sounds like it‚Äôs naturally coming from the surroundings. Every instrument and vocal track are clear and separate. The bass and treble sound great and balanced and if you really like pronounced bass you can turn it up in the equalizer and it thumps. It‚Äôs really hard for me to overstate how awesome the sound is, I listened to a few songs that are now in lossless Dolby atmos on Apple Music and it‚Äôs nothing short of incredible. The best metaphor I can think of is all of my old earbuds were like Standard definition and these are 4K. So if your looking for the best sound for your money and probably the best sound for under 200$ these are the way to go.","Reviewed in the United States August 5, 2021",AE7GOV7WYUWHSSVCGB5SQSMJI34Q,TRUE,76,Color: BlackSize: SmallStyle: True wireless earphone
R19VWKTRIXU414,B08ZR5JB9G,4.0 out of 5 stars Solid choice for ear buds,Crotorious,4,"I've used these ear buds for almost 2 years and strongly considered re-buying them once I started facing issues. When it comes to sound quality, they're good, and the latency is small, but you'll notice it's there. The best part of these ear buds has to be the battery life; these things last all day, and can be fully charged back up twice with the case. Though if you're looking for something with strong noise cancellation, you might want to consider looking for a different pair of ear buds, as these are really only capable of blocking out most speech. Overall, they're a pretty good pair of ear buds, but I do have a few problems with them.First, when they get to low battery, the text to speech voice will say ""Recharge headset"" just frequently enough to become mildly vexing. This is my primary complaint about these ear buds.Now mind you, I haven't treated these ear buds very well, they went through constant abuse and were used in sub-optimal environments the entire time I've owned them. The next two complaints are likely a result of my poor treatment of these.Second, after about two years of use, their connectivity isn't as great anymore; the range in which I can use these has dropped considerably. I used to be able to walk in my backyard without issues, but now I can barely leave the room without the connection dropping constantly.Lastly, the left earbud has recently developed a problem with connecting to the case; it seems the leads just don't connect half the time. This occasionally causes small inconveniences with the left ear bud turning on in the case and randomly hijacking the audio output of my pc, or it just doesn't end up charging and I'm stuck with a single ear bud until I manage to get it to charge again.Overall, this is a pretty good product. I'd recommend it to anyone who needs a pair of long-lasting wireless earbuds and doesn't need the best sound quality or noise cancellation.","Reviewed in the United States December 22, 2023",AFRT3UTZANKCA7EGGKYQAVIXOJ5Q,TRUE,1,Color: BlackSize: SmallStyle: True wireless earphone
RB0NQXL4O1IZ,B08ZR5JB9G,1.0 out of 5 stars Only really lasted 8 months,Jake Boop,1,"Edit: originally rated 1 star as the earbuds that I received were open-box/used. I don‚Äôt think it‚Äôs fair to Sennheiser that my 1 star rating remains on here because that was a fault of Amazon. These earbuds sound great. Absolutely great. The connection seems to be good so far as well (I‚Äôve seen a lot of negative reviews saying otherwise). They are very comfortable for my ears, I‚Äôm a Tool Maker/machinist and wear an earbud in one ear I all day and other earbuds that I‚Äôve tried get uncomfortable or start to fall out but I have had no issues with fit at all. As far as the features on the app: the equalization is only a 3-band eq which is a shame, I‚Äôd much rather at least a 5 or 7-band eq but it‚Äôs better than nothing for sure. The side tone feature is supposed to use the mic to feed into the speaker, allowing you to hear outside talking, but it doesn‚Äôt seem to really work at all. I haven‚Äôt tested a phone call using them yet so maybe my mic is defective but I really wouldn‚Äôt care because I don‚Äôt need it. Overall this is a great pair of earbuds for the price.Original review: This item came in with the packaging already opened with another piece of tape over the original seal. The earbuds were covered in earwax and ear hair. Disgusting. If I wanted to buy an ‚Äúopen box/used‚Äù I would‚Äôve selected that option instead of paying full price for it.Edit 3/14/2023: it's been 8 months and the connectivity issues have been becoming a decent problem. I take them out of the case and they won't connect, so I put them back it and take them out again and usually they'll connect after the second try. But lately I've been having to re-pair them to my phone. I'll take them out of the case and instead of the usual ""power on..... connected"" notification, it's just silence. And it's not as simple as just re-pairing them because they won't go into pairing mode unless I reset them. The battery life is also taking a dive.I started out really loving these, now I've been very disappointed because they're just such a hassle to deal with. With all of this, especially only being 8 months of use, I'm going to have to update my review from 5 stars to 2.Edit 7/17/2023: the right earbud just stopped working all together, it'll power on but refuses to connect to BluetoothEdit 1/24/2024: I've been trying to get as much use out of these just to justify the amount I spent on them before I replace them but all it has really given me is issues with connectivity and reliability. I expect any earbuds at this price range to last years, I should have no problem getting the same life out of earbuds that you would expect from a phone. I wish I would've just either returned them or thrown them away a long time ago. I'm going to start looking into replacements now. Adjusting my 2 star rating to a 1 star.","Reviewed in the United States July 13, 2022",AE2R5XX5O7LVG57B7S2L22VH2QIA,TRUE,10,Color: BlackSize: SmallStyle: True wireless earphone
